[
  {
    "id": "bench-instances-v1",
    "subcircuit": "gemm_coordinate/k1536/sm80.mma.m16n8k16.bf16",
    "target": "first-campaign-target/2026-09-21",
    "dataset": "bench-instances/v1",
    "tier": "vu-k1536",
    "size": 4096,
    "manifest_sha256": "059103cf9bd55ee83cbd4bb14ae6db2f60db2cb4ddf85cdc22b1cecee6e4eeea",
    "seed": null,
    "provenance": "captured",
    "sources": [
      {
        "label": "fixtures/bench-instances/v1/manifest.json (sha256), verity_numerical.bench.instances"
      }
    ]
  },
  {
    "id": "bench-instances-fp8-ada-v1",
    "subcircuit": "gemm_coordinate/k1536/sm89.mma.m16n8k32.e4m3",
    "target": "fp8-ada-mma-draft/2026-09-22",
    "dataset": "bench-instances-fp8-ada/v1",
    "tier": "vu-k1536-fp8-ada",
    "size": 4096,
    "manifest_sha256": "e66ff0f21c8e67d13b4b2d4cee2afa35b8345656b314da80e6b342ba051f078d",
    "seed": 20260922,
    "provenance": "synthetic",
    "sources": [
      {
        "label": "sha256 of 'fp8-ada synthetic|seed=20260922|n=4096|K=1536' (backends/direct/ligero/fp8/chain.py)"
      }
    ]
  },
  {
    "id": "bench-instances-bf16-hopper-v1",
    "subcircuit": "gemm_coordinate/k1536/sm90.mma.m16n8k16.bf16",
    "target": "bf16-hopper-mma-draft/2026-09-22",
    "dataset": "bench-instances-bf16-hopper/v1",
    "tier": "vu-k1536-bf16-hopper",
    "size": 4096,
    "manifest_sha256": "2a5babca16e82727611ae483a125b8d853e27e4c9deedda7c35927cc1e456869",
    "seed": 20260922,
    "provenance": "synthetic",
    "sources": [
      {
        "label": "sha256 of 'bf16-hopper synthetic|seed=20260922|n=4096|K=1536' (backends/direct/ligero/relchain.py)"
      }
    ]
  },
  {
    "id": "bench-instances-fp8-hopper-v1",
    "subcircuit": "gemm_coordinate/k1536/sm90.wgmma.m64n8k32.e4m3",
    "target": "fp8-hopper-wgmma-draft/2026-09-22",
    "dataset": "bench-instances-fp8-hopper/v1",
    "tier": "vu-k1536-fp8-hopper",
    "size": 4096,
    "manifest_sha256": "0ff750026b8d8df0418d3ec360ed6ade683a33b8264d66973021cbfbff7945bc",
    "seed": 20260922,
    "provenance": "synthetic",
    "sources": [
      {
        "label": "sha256 of 'fp8-hopper synthetic|seed=20260922|n=4096|K=1536' (backends/direct/ligero/relchain.py)"
      }
    ]
  },
  {
    "id": "bench-instances-nvfp4-sm120-v1",
    "subcircuit": "gemm_coordinate/k1536/sm120.mma.m16n8k64.e2m1.nvf4",
    "target": "nvfp4-sm120-mma-draft/2026-09-22",
    "dataset": "bench-instances-nvfp4-sm120/v1",
    "tier": "vu-k1536-nvfp4-sm120",
    "size": 4096,
    "manifest_sha256": "d2d65f6523b49e673847746d725fbce3282f2734b0b424637c01e88f188a240a",
    "seed": 20260922,
    "provenance": "synthetic",
    "sources": [
      {
        "label": "sha256 of the fp4-nvf4 recipe string with its 14 families (backends/direct/ligero/fp4/chain.py)"
      }
    ]
  }
]
